id,title,author,text,label
22,Benoît Hamon Wins French Socialist Party’s Presidential Nomination - The New York Times,Alissa J. Rubin,"PARIS  —   France chose an idealistic, traditional   candidate in Sunday’s primary to represent the Socialist and   parties in the presidential election this spring. The candidate, Benoît Hamon, 49, who ran on the slogan that he would “make France’s heart beat,” bested Manuel Valls, the former prime minister, whose campaign has promoted more   policies and who has a strong    background. Mr. Hamon appeared to have won by a wide margin, with incomplete returns showing him with an estimated 58 percent of the vote to Mr. Valls’s 41 percent. “Tonight the left holds its head up high again it is looking to the future,” Mr. Hamon said, addressing his supporters. “Our country needs the left, but a modern, innovative left,” he said. Mr. Hamon’s victory was the clearest sign yet that voters on the left want a break with the policies of President François Hollande, who in December announced that he would not seek  . However, Mr. Hamon’s strong showing is unlikely to change widespread assessments that   candidates have little chance of making it into the second round of voting in the general election. The first round of the general election is set for April 23 and the runoff for May 7. The Socialist Party is deeply divided, and one measure of its lack of popular enthusiasm was the relatively low number of people voting. About two million people voted in the second round of the primary on Sunday, in contrast with about 2. 9 million in the second round of the last presidential primary on the left, in 2011. However, much of the conventional wisdom over how the elections will go has been thrown into question over the past week, because the leading candidate, François Fillon, who represents the main   party, the Republicans, was accused of paying his wife large sums of money to work as his parliamentary aide. While nepotism is legal in the French political system, it is not clear that she actually did any work. Prosecutors who specialize in financial malfeasance are reviewing the case. France’s electoral system allows multiple candidates to run for president in the first round of voting, but only the top two   go on to a second round. Mr. Hamon is entering a race that is already crowded on the left, with candidates who include   Mélenchon on the far left, and Emmanuel Macron, an independent who served as economy minister in Mr. Hollande’s government and who embraces more   policies. Unless he decides to withdraw, Mr. Fillon, the mainstream right candidate, will also run, as will the extreme right candidate Marine Le Pen. The two have been expected to go to the runoff. Mr. Hamon’s victory can be attributed at least in part to his image as an idealist and traditional leftist candidate who appeals to union voters as well as more environmentally concerned and socially liberal young people. Unlike Mr. Valls, he also clearly distanced himself from some of Mr. Hollande’s more unpopular policies, especially the economic ones. Thomas Kekenbosch, 22, a student and one of the leaders of the group the Youth With Benoît Hamon, said Mr. Hamon embodied a new hope for those on the left. “We have a perspective we have something to do, to build,” Mr. Kekenbosch said. Mr. Hollande had disappointed many young people because under him the party abandoned ideals, such as support for workers, that many   voters believe in, according to Mr. Kekenbosch. Mr. Hollande’s government, under pressure from the European Union to meet budget restraints, struggled to pass labor code reforms to make the market more attractive to foreign investors and also to encourage French businesses to expand in France. The measures ultimately passed after weeks of strikes, but they were watered down and generated little concrete progress in improving France’s roughly 10 percent unemployment rate and its nearly 25 percent youth joblessness rate. Mr. Hamon strongly endorses a stimulus approach to improving the economy and has promised to phase in a universal income, which would especially help young people looking for work, but would also supplement the livelihood of   French workers. The end goal would be to have everyone receive 750 euros per month (about $840). “We have someone that trusts us,” Mr. Kekenbosch said, “who says: ‘I give you enough to pay for your studies. You can have a scholarship which spares you from working at McDonald’s on provisional contracts for 4 years. ” Mr. Hamon advocates phasing out diesel fuel and encouraging drivers to replace vehicles that use petroleum products with electrical ones. His leftist pedigree began early. His father worked at an arsenal in Brest, a city in the far west of Brittany, and his mother worked off and on as a secretary. He was an early member of the Movement of Young Socialists, and he has continued to work closely with them through his political life. He also worked for Martine Aubry, now the mayor of Lille and a former Socialist Party leader.",0
23,Excerpts From a Draft Script for Donald Trump’s Q&ampA With a Black Church’s Pastor - The New York Times,nan,"Donald J. Trump is scheduled to make a highly anticipated visit to an   church in Detroit on Saturday, the first such visit of his campaign. There, he will participate in a    session conducted by Bishop Wayne T. Jackson of the church, Great Faith Ministries International. Given the importance of the visit, the Trump team went so far as to script Mr. Trump’s answers to Bishop Jackson’s questions, which were submitted in advance. After this article was published on Thursday night, a campaign official said that Mr. Trump would also speak to the church’s congregation and then tour some neighborhoods with Ben Carson, a former presidential candidate and Detroit native. Below are excerpts from a draft of the script that was obtained by The New York Times. _____ Mr. Trump there is racial divide in our country and it is evident that the tension is boiling over. Case and point Reverend Pinckney in South Carolina was gunned down when a white young man came into their Bible Study and slaughtered the Reverend and eight other individuals because he wanted to start a race war. What would your administration do to bring down the racial tension that is in our Country? In the Bible Jesus said that a house divided cannot stand. Our best hope for erasing racial tensions in America is to work toward a   society. In business, we hire, retain and award based on merit. In society, however, we have divisions that can only be eliminated if we have equal opportunity and then equal access to programs and institutions that will lift all people in the country. We have to reform our tax system so that we can spur economic growth for the long haul. We have to have stronger enforcement of immigration laws. We have to renegotiate our trade deals so that we can bring advantage back to the American workforce. But perhaps most important is that we must provide equal opportunity for a quality education for all Americans. The higher the educational attainment, the greater the likelihood one can climb the economic ladder. We must bring school choice programs to our cities and we must get rid of Common Core. We must make sure that access, affordability and accountability are brought into our higher education system. Without a focus on educational outcomes for every American, we will perpetuate the permanent underclass that progressive policies have sustained. Republicans like me need to have the courage to speak the truth about where we are and what has to be done. We have to have the courage to go into communities and work with everyone there to make sure that our schools are good and that our children have access to the whatever educational situation they may need. This is not something one person can do, but it is something that we can do together. _____ Mr. Trump there is a perception that your administration is racist. With many of the African American voters their belief is that the Republican Party as a whole does not cater to African American needs. In 2008 and 2012 we had two Republican Candidates John McCain and Mitt Romney and neither one of them came to Detroit, or any urban area that I can remember to even address the concerns of our community. First I would like to commend you for coming to our community as a Republican Candidate. Second I need to know how would you change that perception in our community? The proof, as they say, will be in the pudding. Coming into a community is meaningless unless we can offer an alternative to the horrible progressive agenda that has perpetuated a permanent underclass in America. We need to be true to our word and offer all Americans more opportunities so that each and every one of them can reach their full potential. This means economic policies that will bring jobs back to America and will raise wages for all. This means working hard to provide as many educational options as possible to our parents and children. This means cleaning up drugs and making our neighborhoods and communities safer. We need to get people off welfare and back to work. We need to make sure that anyone who qualifies can go into a bank, get a loan and then start a business. We need to reduce regulations and expand options for people who want to be independent of government. We need to make sure that people can worship how they want and where they want without worrying that some federal agency is going to threaten the religious liberties. Republicans have better options. We just need to have the courage to present them with conviction. _____ Mr. Trump what is your vision for America? And specifically Black America? If you repeal Obama care what is your plan to provide health care and medicine to those who can’t afford it, yet need it the most? As President, I must serve all Americans without regard to race, ethnicity or any other qualification. I must approach my task with the utmost wisdom and make sure that all Americans have opportunities to achieve to their potential. If we are to Make America Great Again, we must reduce, rather than highlight, issues of race in this country. I want to make race disappear as a factor in government and governance. Every individual, regardless of race or ethnicity, must have access to the full array of opportunities in America. My vision for America is that every citizen and legal resident of this nation will be able to stand side by side and be proud of the fact that they live in the greatest nation on earth. As for the Affordable Care Act, I will work to repeal the act and replace it with market driven solutions that will offer more access to healthcare at more affordable prices. Every American should be able to purchase health insurance across state lines, have health savings account that belong to them, have price transparency so they can shop for the best services at the best prices and know that they will not have to compete with those who are clogging the system simply because they are in this country illegally. We want to block grant Medicaid so that states can provide services closer to the people. We want to make sure that every American has great economic opportunity so that they can seek out their own health insurance and still be able to afford it. This approach will serve all Americans and will ensure that more Americans are covered by better insurance and healthcare options. _____ Mr. Trump I am a registered Democrat but I am an undecided voter in this election for 2016. It is not only myself but there has been a lot of Pastors and African Americans who have not made up their minds concerning who they are going to cast their vote for. The latest polls indicate that you have 1 percent of the African American vote. What can you say to undecided voters such as myself and others in the African American Community that will win our vote on November 8, 2016? And beyond winning, why is the African American vote important to you? All votes are important to me and my campaign. Your vote, your neighbor’s vote, the vote of every American is critical and I must do all I can to make sure you know that if you vote for me, you are voting for a stronger, more vibrant America. My policies offer you a clear choice. You can continue down the road of progressivism that has created a permanent underclass in this country that, unfortunately, includes far too many people of color. If you want a better America, you must break from the historical hold that Democrats have had on people of color and move to options that allow you to achieve your potential. This is all about opportunity  —   not   outcomes and promises of things to come that never materialize. The progressives have worked tirelessly to bring all Americans down to one level rather than allowing as many as possible to rise as high as possible. Education, jobs, religious liberty and protection of civil rights are the promises that I will keep, not just utter to gain favor. If you are interested in a greater America with more opportunity, liberty and prosperity, you must take a chance and walk over to my side. If you want a strong partner in this journey, you will vote for me. I will never let you down. By the way, my support is now up to 8% and climbing.",0
24,"A Back-Channel Plan for Ukraine and Russia, Courtesy of Trump Associates - The New York Times",Megan Twohey and Scott Shane,"A week before Michael T. Flynn resigned as national security adviser, a sealed proposal was   to his office, outlining a way for President Trump to lift sanctions against Russia. Mr. Flynn is gone, having been caught lying about his own discussion of sanctions with the Russian ambassador. But the proposal, a peace plan for Ukraine and Russia, remains, along with those pushing it: Michael D. Cohen, the president’s personal lawyer, who delivered the document Felix H. Sater, a business associate who helped Mr. Trump scout deals in Russia and a Ukrainian lawmaker trying to rise in a political opposition movement shaped in part by Mr. Trump’s former campaign manager Paul Manafort. At a time when Mr. Trump’s ties to Russia, and the people connected to him, are under heightened scrutiny  —   with investigations by American intelligence agencies, the F. B. I. and Congress  —   some of his associates remain willing and eager to wade into   efforts behind the scenes. Mr. Trump has confounded Democrats and Republicans alike with his repeated praise for the Russian president, Vladimir V. Putin, and his desire to forge an   alliance. While there is nothing illegal about such unofficial efforts, a proposal that seems to tip toward Russian interests may set off alarms. The amateur diplomats say their goal is simply to help settle a grueling,   conflict that has cost 10, 000 lives. “Who doesn’t want to help bring about peace?” Mr. Cohen asked. But the proposal contains more than just a peace plan. Andrii V. Artemenko, the Ukrainian lawmaker, who sees himself as a   leader of a future Ukraine, claims to have evidence  —   “names of companies, wire transfers”  —   showing corruption by the Ukrainian president, Petro O. Poroshenko, that could help oust him. And Mr. Artemenko said he had received encouragement for his plans from top aides to Mr. Putin. “A lot of people will call me a Russian agent, a U. S. agent, a C. I. A. agent,” Mr. Artemenko said. “But how can you find a good solution between our countries if we do not talk?” Mr. Cohen and Mr. Sater said they had not spoken to Mr. Trump about the proposal, and have no experience in foreign policy. Mr. Cohen is one of several Trump associates under scrutiny in an F. B. I. counterintelligence examination of links with Russia, according to law enforcement officials he has denied any illicit connections. The two others involved in the effort have somewhat questionable pasts: Mr. Sater, 50, a   pleaded guilty to a role in a stock manipulation scheme decades ago that involved the Mafia. Mr. Artemenko spent two and a half years in jail in Kiev in the early 2000s on embezzlement charges, later dropped, which he said had been politically motivated. While it is unclear if the White House will take the proposal seriously, the diplomatic freelancing has infuriated Ukrainian officials. Ukraine’s ambassador to the United States, Valeriy Chaly, said Mr. Artemenko “is not entitled to present any alternative peace plans on behalf of Ukraine to any foreign government, including the U. S. administration. ” At a security conference in Munich on Friday, Mr. Poroshenko warned the West against “appeasement” of Russia, and some American experts say offering Russia any alternative to a    international agreement on Ukraine would be a mistake. The Trump administration has sent mixed signals about the conflict in Ukraine. But given Mr. Trump’s praise for Mr. Putin, John Herbst, a former American ambassador to Ukraine, said he feared the new president might be too eager to mend relations with Russia at Ukraine’s expense  —   potentially with a plan like Mr. Artemenko’s. It was late January when the three men associated with the proposed plan converged on the Loews Regency, a luxury hotel on Park Avenue in Manhattan where business deals are made in a lobby furnished with leather couches, over martinis at the restaurant bar and in private conference rooms on upper floors. Mr. Cohen, 50, lives two blocks up the street, in Trump Park Avenue. A lawyer who joined the Trump Organization in 2007 as special counsel, he has worked on many deals, including a   tower in the republic of Georgia and a   mixed martial arts venture starring a Russian fighter. He is considered a loyal lieutenant whom Mr. Trump trusts to fix difficult problems. The F. B. I. is reviewing an unverified dossier, compiled by a former British intelligence agent and funded by Mr. Trump’s political opponents, that claims Mr. Cohen met with a Russian representative in Prague during the presidential campaign to discuss Russia’s hacking of Democratic targets. But the Russian official named in the report told The New York Times that he had never met Mr. Cohen. Mr. Cohen insists that he has never visited Prague and that the dossier’s assertions are fabrications. (Mr. Manafort is also under investigation by the F. B. I. for his connections to Russia and Ukraine.) Mr. Cohen has a personal connection to Ukraine: He is married to a Ukrainian woman and once worked with relatives there to establish an ethanol business. Mr. Artemenko, tall and burly, arrived at the Manhattan hotel between visits to Washington. (His wife, he said, met the first lady, Melania Trump, years ago during their modeling careers, but he did not try to meet Mr. Trump.) He had attended the inauguration and visited Congress, posting on Facebook his admiration for Mr. Trump and talking up his peace plan in meetings with American lawmakers. He entered Parliament in 2014, the year that the former Ukrainian president Viktor Yanukovych fled to Moscow amid protests over his economic alignment with Russia and corruption. Mr. Manafort, who had been instrumental in getting Mr. Yanukovych elected, helped shape a political bloc that sprang up to oppose the new president, Mr. Poroshenko, a wealthy businessman who has taken a far tougher stance toward Russia and accused Mr. Putin of wanting to absorb Ukraine into a new Russian Empire. Mr. Artemenko, 48, emerged from the opposition that Mr. Manafort nurtured. (The two men have never met, Mr. Artemenko said.) Before entering politics, Mr. Artemenko had business ventures in the Middle East and real estate deals in the Miami area, and had worked as an agent representing top Ukrainian athletes. Some colleagues in Parliament describe him as corrupt, untrustworthy or simply insignificant, but he appears to have amassed considerable wealth. He has fashioned himself in the image of Mr. Trump, presenting himself as Ukraine’s answer to a rising class of nationalist leaders in the West. He even traveled to Cleveland last summer for the Republican National Convention, seizing on the chance to meet with members of Mr. Trump’s campaign. “It’s time for new leaders, new approaches to the governance of the country, new principles and new negotiators in international politics,” he wrote on Facebook on Jan. 27. “Our time has come!” Mr. Artemenko said he saw in Mr. Trump an opportunity to advocate a plan for peace in Ukraine  —   and help advance his own political career. Essentially, his plan would require the withdrawal of all Russian forces from eastern Ukraine. Ukrainian voters would decide in a referendum whether Crimea, the Ukrainian territory seized by Russia in 2014, would be leased to Russia for a term of 50 or 100 years. The Ukrainian ambassador, Mr. Chaly, rejected a lease of that kind. “It is a gross violation of the Constitution,” he said in written answers to questions from The Times. “Such ideas can be pitched or pushed through only by those openly or covertly representing Russian interests. ” The reaction suggested why Mr. Artemenko’s project also includes the dissemination of “kompromat,” or compromising material, purportedly showing that Mr. Poroshenko and his closest associates are corrupt. Only a new government, presumably one less hostile to Russia, might take up his plan. Mr. Sater, a longtime business associate of Mr. Trump’s with connections in Russia, was willing to help Mr. Artemenko’s proposal reach the White House. Mr. Trump has sought to distance himself from Mr. Sater in recent years. If Mr. Sater “were sitting in the room right now,” Mr. Trump said in a 2013 deposition, “I really wouldn’t know what he looked like. ” But Mr. Sater worked on real estate development deals with the Trump Organization on and off for at least a decade, even after his role in the stock manipulation scheme came to light. Mr. Sater, who was born in the Soviet Union and grew up in New York, served as an executive at a firm called Bayrock Group, two floors below the Trump Organization in Trump Tower, and was later a senior adviser to Mr. Trump. He said he had been working on a plan for a Trump Tower in Moscow with a Russian real estate developer as recently as the fall of 2015, one that he said had come to a halt because of Mr. Trump’s presidential campaign. (Mr. Cohen said the Trump Organization had received a letter of intent for a project in Moscow from a Russian real estate developer at that time but determined that the project was not feasible.) Mr. Artemenko said a mutual friend had put him in touch with Mr. Sater. Helping to advance the proposal, Mr. Sater said, made sense. “I want to stop a war, number one,” he said. “Number two, I absolutely believe that the U. S. and Russia need to be allies, not enemies. If I could achieve both in one stroke, it would be a home run. ” After speaking with Mr. Sater and Mr. Artemenko in person, Mr. Cohen said he would deliver the plan to the White House. Mr. Cohen said he did not know who in the Russian government had offered encouragement on it, as Mr. Artemenko claims, but he understood there was a promise of proof of corruption by the Ukrainian president. “Fraud is never good, right?” Mr. Cohen said. He said Mr. Sater had given him the written proposal in a sealed envelope. When Mr. Cohen met with Mr. Trump in the Oval Office in early February, he said, he left the proposal in Mr. Flynn’s office. Mr. Cohen said he was waiting for a response when Mr. Flynn was forced from his post. Now Mr. Cohen, Mr. Sater and Mr. Artemenko are hoping a new national security adviser will take up their cause. On Friday the president wrote on Twitter that he had four new candidates for the job.",0
