id,title,author,text,label
0,House Dem Aide,Darrell Lucus,old school.,1
1,"FLYNN: Hillary Clinton, Big Woman on Campus - Breitbart",Daniel J. Flynn,"Ever get the feeling your life circles the roundabout rather than heads in a straight line toward the intended destination? [Hillary Clinton remains the big woman on campus in leafy, liberal Wellesley, Massachusetts. Everywhere else votes her most likely to don her inauguration dress for the remainder of her days the way Miss Havisham forever wore that wedding dress.  Speaking of Great Expectations, Hillary Rodham overflowed with them 48 years ago when she first addressed a Wellesley graduating class. The president of the college informed those gathered in 1969 that the students needed “no debate so far as I could ascertain as to who their spokesman was to be” (kind of the like the Democratic primaries in 2016 minus the   terms unknown then even at a Seven Sisters school). “I am very glad that Miss Adams made it clear that what I am speaking for today is all of us —  the 400 of us,” Miss Rodham told her classmates. After appointing herself Edger Bergen to the Charlie McCarthys and Mortimer Snerds in attendance, the    bespectacled in granny glasses (awarding her matronly wisdom —  or at least John Lennon wisdom) took issue with the previous speaker. Despite becoming the first   to win election to a seat in the U. S. Senate since Reconstruction, Edward Brooke came in for criticism for calling for “empathy” for the goals of protestors as he criticized tactics. Though Clinton in her senior thesis on Saul Alinsky lamented “Black Power demagogues” and “elitist arrogance and repressive intolerance” within the New Left, similar words coming out of a Republican necessitated a brief rebuttal. “Trust,” Rodham ironically observed in 1969, “this is one word that when I asked the class at our rehearsal what it was they wanted me to say for them, everyone came up to me and said ‘Talk about trust, talk about the lack of trust both for us and the way we feel about others. Talk about the trust bust.’ What can you say about it? What can you say about a feeling that permeates a generation and that perhaps is not even understood by those who are distrusted?” The “trust bust” certainly busted Clinton’s 2016 plans. She certainly did not even understand that people distrusted her. After Whitewater, Travelgate, the vast   conspiracy, Benghazi, and the missing emails, Clinton found herself the distrusted voice on Friday. There was a load of compromising on the road to the broadening of her political horizons. And distrust from the American people —  Trump edged her 48 percent to 38 percent on the question immediately prior to November’s election —  stood as a major reason for the closing of those horizons. Clinton described her vanquisher and his supporters as embracing a “lie,” a “con,” “alternative facts,” and “a   assault on truth and reason. ” She failed to explain why the American people chose his lies over her truth. “As the history majors among you here today know all too well, when people in power invent their own facts and attack those who question them, it can mark the beginning of the end of a free society,” she offered. “That is not hyperbole. ” Like so many people to emerge from the 1960s, Hillary Clinton embarked upon a long, strange trip. From high school Goldwater Girl and Wellesley College Republican president to Democratic politician, Clinton drank in the times and the place that gave her a degree. More significantly, she went from idealist to cynic, as a comparison of her two Wellesley commencement addresses show. Way back when, she lamented that “for too long our leaders have viewed politics as the art of the possible, and the challenge now is to practice politics as the art of making what appears to be impossible possible. ” Now, as the big woman on campus but the odd woman out of the White House, she wonders how her current station is even possible. “Why aren’t I 50 points ahead?” she asked in September. In May she asks why she isn’t president. The woman famously dubbed a “congenital liar” by Bill Safire concludes that lies did her in —  theirs, mind you, not hers. Getting stood up on Election Day, like finding yourself the jilted bride on your wedding day, inspires dangerous delusions.",0
2,Why the Truth Might Get You Fired,Consortiumnews.com,"Why the Truth Might Get You Fired October 29, 2016 
The tension between intelligence analysts and political policymakers has always been between honest assessments and desired results, with the latter often overwhelming the former, as in the Iraq War, writes Lawrence Davidson. 
By Lawrence Davidson 
For those who might wonder why foreign policy makers repeatedly make bad choices, some insight might be drawn from the following analysis. The action here plays out in the United States, but the lessons are probably universal. 
Back in the early spring of 2003, George W. Bush initiated the invasion of Iraq. One of his key public reasons for doing so was the claim that the country’s dictator, Saddam Hussein, was on the verge of developing nuclear weapons and was hiding other weapons of mass destruction. The real reason went beyond that charge and included a long-range plan for “regime change” in the Middle East. President George W. Bush and Vice President Dick Cheney receive an Oval Office briefing from CIA Director George Tenet. Also present is Chief of Staff Andy Card (on right). (White House photo) 
For our purposes, we will concentrate on the belief that Iraq was about to become a hostile nuclear power. Why did President Bush and his close associates accept this scenario so readily? 
The short answer is Bush wanted, indeed needed, to believe it as a rationale for invading Iraq. At first he had tried to connect Saddam Hussein to the 9/11 attacks on the U.S. Though he never gave up on that stratagem, the lack of evidence made it difficult to rally an American people, already fixated on Afghanistan, to support a war against Baghdad. 
But the nuclear weapons gambit proved more fruitful, not because there was any hard evidence for the charge, but because supposedly reliable witnesses, in the persons of exiled anti-Saddam Iraqis (many on the U.S. government’s payroll ), kept telling Bush and his advisers that the nuclear story was true. 
What we had was a U.S. leadership cadre whose worldview literally demanded a mortally dangerous Iraq, and informants who, in order to precipitate the overthrow of Saddam, were willing to tell the tale of pending atomic weapons. The strong desire to believe the tale of a nuclear Iraq lowered the threshold for proof . Likewise, the repeated assertions by assumed dependable Iraqi sources underpinned a nationwide U.S. campaign generating both fear and war fever. 
So the U.S. and its allies insisted that the United Nations send in weapons inspectors to scour Iraq for evidence of a nuclear weapons program (as well as chemical and biological weapons). That the inspectors could find no convincing evidence only frustrated the Bush administration and soon forced its hand. 
On March 19, 2003, Bush launched the invasion of Iraq with the expectation was that, once in occupation of the country, U.S. inspectors would surely find evidence of those nukes (or at least stockpiles of chemical and biological weapons). They did not. Their Iraqi informants had systematically lied to them. 
Social and Behavioral Sciences to the Rescue? 
The various U.S. intelligence agencies were thoroughly shaken by this affair, and today, 13 years later, their directors and managers are still trying to sort it out – specifically, how to tell when they are getting “true” intelligence and when they are being lied to. Or, as one intelligence worker has put it, we need “ help to protect us against armies of snake oil salesmen. ” To that end the CIA et al. are in the market for academic assistance. Ahmed Chalabi, head of the Iraqi National Congress, a key supplier of Iraqi defectors with bogus stories of hidden WMD. 
A “partnership” is being forged between the Office of the Director of National Intelligence (ODNI), which serves as the coordinating center for the sixteen independent U.S. intelligence agencies, and the National Academies of Sciences, Engineering and Medicine . The result of this collaboration will be a “ permanent Intelligence Community Studies Board” to coordinate programs in “social and behavioral science research [that] might strengthen national security .” 
Despite this effort, it is almost certain that the “social and behavioral sciences” cannot give the spy agencies what they want – a way of detecting lies that is better than their present standard procedures of polygraph tests and interrogations. But even if they could, it might well make no difference, because the real problem is not to be found with the liars. It is to be found with the believers. 
The Believers 
It is simply not true, as the ODNI leaders seem to assert, that U.S. intelligence agency personnel cannot tell, more often than not, that they are being lied to. This is the case because there are thousands of middle-echelon intelligence workers, desk officers, and specialists who know something closely approaching the truth – that is, they know pretty well what is going on in places like Afghanistan, Iraq, Syria, Libya, Israel, Palestine and elsewhere. Director of National Intelligence James Clapper (right) talks with President Barack Obama in the Oval Office, with John Brennan and other national security aides present. (Photo credit: Office of Director of National Intelligence) 
Therefore, if someone feeds them “snake oil,” they usually know it. However, having an accurate grasp of things is often to no avail because their superiors – those who got their appointments by accepting a pre-structured worldview – have different criterion for what is “true” than do the analysts. 
Listen to Charles Gaukel, of the National Intelligence Council – yet another organization that acts as a meeting ground for the 16 intelligence agencies. Referring to the search for a way to avoid getting taken in by lies, Gaukel has declared, “ We’re looking for truth. But we’re particularly looking for truth that works. ” Now what might that mean? 
I can certainly tell you what it means historically. It means that for the power brokers, “truth” must match up, fit with, their worldview – their political and ideological precepts. If it does not fit, it does not “work.” So the intelligence specialists who send their usually accurate assessments up the line to the policy makers often hit a roadblock caused by “group think,” ideological blinkers, and a “we know better” attitude. 
On the other hand, as long as what you’re selling the leadership matches up with what they want to believe, you can peddle them anything: imaginary Iraqi nukes, Israel as a Western-style democracy, Saudi Arabia as an indispensable ally, Libya as a liberated country, Bashar al-Assad as the real roadblock to peace in Syria, the Strategic Defense Initiative (SDI) aka Star Wars, a world that is getting colder and not warmer, American exceptionalism in all its glory – the list is almost endless. 
What does this sad tale tell us? If you want to spend millions of dollars on social and behavioral science research to improve the assessment and use of intelligence, forget about the liars. What you want to look for is an antidote to the narrow-mindedness of the believers – the policymakers who seem not to be able to rise above the ideological presumptions of their class – presumptions that underpin their self-confidence as they lead us all down slippery slopes. 
It has happened this way so often, and in so many places, that it is the source of Shakespeare’s determination that “what is past, is prelude.” Our elites play out our destinies as if they have no free will – no capacity to break with structured ways of seeing. Yet the middle-echelon specialists keep sending their relatively accurate assessments up the ladder of power. Hope springs eternal.",1
3,15 Civilians Killed In Single US Airstrike Have Been Identified,Jessica Purkiss,"Videos 15 Civilians Killed In Single US Airstrike Have Been Identified The rate at which civilians are being killed by American airstrikes in Afghanistan is now higher than it was in 2014 when the US was engaged in active combat operations.   Photo of Hellfire missiles being loaded onto a US military Reaper drone in Afghanistan by Staff Sgt. Brian Ferguson/U.S. Air Force. 
The Bureau has been able to identify 15 civilians killed in a single US drone strike in Afghanistan last month – the biggest loss of civilian life in one strike since the attack on the Medecins Sans Frontieres hospital (MSF) last October. 
The US claimed it had conducted a “counter-terrorism” strike against Islamic State (IS) fighters when it hit Nangarhar province with missiles on September 28. But the next day the United Nations issued an unusually rapid and strong statement saying the strike had killed 15 civilians and injured 13 others who had gathered at a house to celebrate a tribal elder’s return from a pilgrimage to Mecca. 
The Bureau spoke to a man named Haji Rais who said he was the owner of the house that was targeted. He said 15 people were killed and 19 others injured, and provided their names (listed below). The Bureau was able to independently verify the identities of those who died. 
Rais’ son, a headmaster at a local school, was among them. Another man, Abdul Hakim, lost three of his sons in the attack. 
Rais said he had no involvement with IS and denied US claims that IS members had visited his house before the strike. He said: “I did not even speak to those sort of people on the phone let alone receiving them in my house.” 
The deaths amount to the biggest confirmed loss of civilian life in a single American strike in Afghanistan since the attack on the MSF hospital in Kunduz last October, which killed at least 42 people. 
The Nangarhar strike was not the only US attack to kill civilians in September. The Bureau’s data indicates that as many as 45 civilians and allied soldiers were killed in four American strikes in Afghanistan and Somalia that month. 
On September 18 a pair of strikes killed eight Afghan policemen in Tarinkot, the capital of Urozgan provice. US jets reportedly hit a police checkpoint, killing one officer, before returning to target first responders. The use of this tactic – known as a “double-tap” strike – is controversial because they often hit civilian rescuers. 
The US told the Bureau it had conducted the strike against individuals firing on and posing a threat to Afghan forces. The email did not directly address the allegations of Afghan policemen being killed. 
At the end of the month in Somalia, citizens burnt US flags on the streets of the north-central city of Galcayo after it emerged a drone attack may have unintentionally killed 22 Somali soldiers and civilians. The strike occurred on the same day as the one in Nangarhar. 
In both the Somali and Afghan incidents, the US at first denied that any non-combatants had been killed. It is now investigating both the strikes in Nangarhar and Galcayo. 
The rate at which civilians are being killed by American airstrikes in Afghanistan is now higher than it was in 2014 when the US was engaged in active combat operations. Name",1
4,Iranian woman jailed for fictional unpublished story about woman stoned to death for adultery,Howard Portnoy,"Print 
An Iranian woman has been sentenced to six years in prison after Iran’s Revolutionary Guard searched her home and found a notebook that contained a fictional story she’d written about a woman who was stoned to death, according to the Eurasia Review . 
Golrokh Ebrahimi Iraee, 35, is the wife of political prisoner Arash Sadeghi, 36, who is serving a 19-year prison sentence for being a human rights activist, the publication reported. 
“When the intelligence unit of the Revolutionary Guards came to arrest her husband, they raided their apartment – without a warrant – and found drafts of stories that Ebrahimi Iraee had written,” the article stated. 
“One of the confiscated drafts was a story about stoning women to death for adultery – never published, never presented to anyone,” the article stated. “The narrative followed the story of a protagonist that watched a movie about stoning of women under Islamic law for adultery.",1
5,Jackie Mason: Hollywood Would Love Trump if He Bombed North Korea over Lack of Trans Bathrooms (Exclusive Video) - Breitbart,Daniel Nussbaum,"In these trying times, Jackie Mason is the Voice of Reason. [In this week’s exclusive clip for Breitbart News, Jackie discusses the looming threat of North Korea, and explains how President Donald Trump could win the support of the Hollywood left if the U. S. needs to strike first.  “If he decides to bomb them, the whole country will be behind him, because everybody will realize he had no choice and that was the only thing to do,” Jackie says. “Except the Hollywood left. They’ll get nauseous. ” “[Trump] could win the left over, they’ll fall in love with him in a minute. If he bombed them for a better reason,” Jackie explains. “Like if they have no transgender toilets. ” Jackie also says it’s no surprise that Hollywood celebrities didn’t support Trump’s strike on a Syrian airfield this month. “They were infuriated,” he says. “Because it might only save lives. That doesn’t mean anything to them. If it only saved the environment, or climate change! They’d be the happiest people in the world. ” Still, Jackie says he’s got nothing against Hollywood celebs. They’ve got a tough life in this country. Watch Jackie’s latest clip above.   Follow Daniel Nussbaum on Twitter: @dznussbaum",0
6,"Life: Life Of Luxury: Elton John’s 6 Favorite Shark Pictures To Stare At During Long, Transcontinental Flights",nan,"Ever wonder how Britain’s most iconic pop pianist gets through a long flight? Here are the six pictures of sharks Sir Elton John likes to stare at to pass the time on an airplane. 1. A Shark Swimming 
Sit next to Elton John on a flight and you’ll see a man living in the lap of luxury, as he immediately tapes this photo of a shark darting through the ocean over his window to stare at throughout the trip. The platinum-selling artist has been known to pull his window shade down to make the shark disappear, and then quickly retract it to mark the animal’s triumphant return. He will often repeat this act dozens of times per flight. 2. A Great White Shark Leaping Into The Air 
When you’re an international pop sensation worth an estimated $450 million, people go the extra mile to make you happy. Flight crews are instructed to place this photo of a breaching great white in Elton John’s seat-back pocket before he even boards the plane. The five-time Grammy winner loves to pull the image out at his leisure to stare at while flying, sometimes holding it a mere 3-to-4 inches away from his face while he fixates upon the shark’s beady eyes. 3. A Shark On The Prowl 
Rumor has it Elton John first acquired this shark photo in 1997, just before flying to London to perform “Candle In The Wind” at Princess Diana’s funeral. It’s been a staple of his travel routine ever since. Those who have flown with the music legend say that Sir Elton turns on every single overhead light in his row to study this picture with a magnifying glass. 4. Two Hammerhead Sharks 
How does the man behind “Tiny Dancer” and “Rocket Man” handle turbulence as his plane traverses the Atlantic? Once that “Fasten Seat Belts” sign lights up, this picture of two hammerhead sharks comes out. Elton John holds the photo in a tight vice grip and stares straight at it until the turbulence passes, often without blinking for minutes at a time. 5. The Poster For Jaws 
Sir Elton John absolutely adores the poster for Steven Spielberg’s Jaws and hopes to one day see the film. In the meantime, the British icon makes do by slowly unfolding his 24-by-36-inch copy of the poster whenever he’s on a long flight, gently tracing the shark’s teeth with his finger as he stares lovingly into its gaping mouth. 6. Pilot’s Choice 
As much as Elton relishes in the calming regularity of his shark picture rotation, he also loves the excitement of gazing upon a totally unexpected shark when flying from London to a distant corner of Europe. That’s why all pilots who fly Sir Elton print out a shark picture of their choice from their home computers before going to the airport, and hand it to the visibly excited musician prior to takeoff. So yeah—it’s good to be Elton!",1
