id,title,author,text,label
10,Obama’s Organizing for Action Partners with Soros-Linked ‘Indivisible’ to Disrupt Trump’s Agenda,Aaron Klein,"Organizing for Action, the activist group that morphed from Barack Obama’s first presidential campaign, has partnered with the   Indivisible Project for “online trainings” on how to protest President Donald Trump’s agenda. [Last week, Breitbart News extensively reported that Indivisible leaders are openly associated with groups financed by billionaire George Soros.  Politico earlier this month profiled Indivisible in an article titled, “Inside the protest movement that has Republicans reeling. ”  The news agency not only left out the Soros links, but failed to note that the organizations cited in its article as helping to amplify Indivisible’s message are either financed directly by Soros or have close ties to groups funded by the billionaire, as Breitbart News documented. Organizing for Action (OFA) is a   community organizing project that sprung from Obama’s 2012 campaign organization, Organizing for America, becoming a nonprofit described by the Washington Post as “advocate[ing] for the president’s policies. ” In a recent Facebook post titled, “Take a deep breath. Then take action,” OFA called on constituents to lobby particularly hard between now and February 26, when lawmakers will be in their home districts. The post included a link to a guide released by Indivisible on how to organize against Trump. “Stay tuned for online trainings and invitations to calls with coalition partners like Indivisible Guide,” the OFA post states. Paul Sperry, writing at the New York Post, relates: The manual, published with OFA partner “Indivisible,” advises protesters to go into halls quietly so as not to raise alarms, and “grab seats at the front of the room but do not all sit together. ” Rather, spread out in pairs to make it seem like the whole room opposes the Republican host’s positions. “This will help reinforce the impression of broad consensus. ” It also urges them to ask “hostile” questions  —   while keeping “a firm hold on the mic”  —   and loudly boo the the GOP politician if he isn’t “giving you real answers. ” “Express your concern [to the event’s hosts] they are giving a platform to   authoritarianism, racism, and corruption,” it says.   …    “Even the safest [Republican] will be deeply alarmed by signs of organized opposition,” the document states, “because these actions create the impression that they’re not connected to their district and not listening to their constituents. ” Sperry reported OFA “plans to stage 400 rallies across 42 states this year to attack Trump and Republicans over ObamaCare’s repeal. ” Earlier this month, NBC News reported on OFA’s new actions and its partnership with Indivisible: OFA has hired 14 field organizers in states home to key senators as part of its campaign to defend Obama’s signature healthcare law. To run that campaign, the group hired Saumya Narechania  —   the former national field director at Enroll America, which worked to sign people up for Obamacare  —   and a deputy campaign manager.   …    OFA says more than 1, 800 people have applied to its Spring Community Engagement Fellowship, a   training program,   of whom have not previously been involved with OFA. And the group has teamed up with Indivisible, a buzzy newcomer to the progressive movement, to offer organizing training that began Thursday night with a video conference. A combined 25, 000 people have registered to participate in those trainings, OFA said. Indivisible’s DC branch was implicated in a scuffle last week that reportedly injured a    staffer for Rep. Dana Rohrabacher ( ) as well as reportedly knocking a    to the ground.  Protesters claimed they were only delivering Valentine’s Day cards. Indivisible is a part of a coalition of activist groups slated to hold a massive   Tax March in Washington and at least 60 other locations on April 15. Unreported by the news media is that most of the listed partners and support organizers of the march are openly financed by Soros or have close links to Soros financing, as Breitbart News documented last week. Meanwhile, earlier this month, Politico profiled Indivisible and reported that “conservatives” are “spreading unfounded rumors” that the group is “being driven by wealthy donors like George Soros. ” Politico, however, seemingly failed to do even the most minimal research on the Indivisible leaders cited in the news outlet’s own profile.  Some of those personalities are openly associated with groups financed by Soros. Politico further failed to note that the organizations cited in its article as helping to amplify Indivisible’s message are either financed directly by Soros or have close ties to groups funded by the billionaire. Citing Angel Padilla, a   of the group, Politico reported: Dubbed “Indivisible,” the group launched as a way for Padilla and a handful of fellow   aides to channel their   heartbreak into a manual for quashing President Donald Trump’s agenda. They drafted a   protest guide for activists, full of pointers on how to bird dog their members of Congress in the language of Capitol insiders. The manual has since been downloaded over one million times. Indivisible says on its website that over 4, 500 local groups across the nation have “signed up to resist the Trump agenda in nearly every congressional district in the country. ” The manual has been utilized to form the basis of a protest movement. The group’s website states: “What’s more, you all are putting the guide into action —  showing up en masse to congressional district offices and events, and flooding the congressional phone lines. You’re resisting —  and it’s working. ” Politico reported on “unfounded” rumors being spread about Soros’s involvement with Indivisible (emphasis added by this reporter): Its handful of senior leaders count about 100 contributors to their national organizing work but insist that all are working on a volunteer basis. They know conservatives are spreading unfounded rumors that their success is being driven by wealthy donors like George Soros, which they flatly deny. That paragraph was followed by the following quote from   Padilla (emphasis again added by this reporter): “It doesn’t matter who we take money from  —   we’re always going to get blamed as a Soros group, even if we don’t take money from Soros,” said Padilla, now an analyst with the National Immigration Law Center. “That’s one of the attacks and that’s fine. ” While “Indivisible” has yet to disclose its donors, Politico failed to inform readers that the National Immigration Law Center where the news outlet reported Padilla serves as an analyst is financed by Soros’s Open Society Foundations. The Center has received numerous Open Society grants earmarked for general support. Also unmentioned by Politico is that Padilla previously served as an immigration policy consultant at the radical National Council of La Raza. Soros is a major La Raza donor. Politico went on to detail how Indivisible has been aided by MoveOn. org and the ACLU.  The news website failed to tell readers that MoveOn. org and the ACLU are both financed by Soros, a relevant tidbit given Politico’s claim about “unfounded rumors” that Indivisibles’ success was being driven by Soros .  The news website reported: In addition, MoveOn. org and the Working Families Party joined with Indivisible for its first nationwide call on Jan. 22. Nearly 60, 000 people phoned in that day, according to Levin and MoveOn organizing director Victoria Kaplan. Indivisible estimates that its second national call, on the impact of Trump’s immigration order with assistance from the ACLU and Padilla’s group, drew 35, 000 people. Politico also missed that, according to its Twitter account, another organizer of the conference call with MoveOn. org was the International Refugee Assistance Project, a project of the Urban Justice Center, another recipient of an Open Society grant. Taryn Higashi, executive director of the Center’s International Refugee Assistance Project, currently serves on the Advisory Board of the International Migration Initiative of Soros’s Open Society Foundations. Politico further reported on Indivisible’s ties to the organizers of last month’s   Women’s March while failing to mention that Soros reportedly has ties to more than 50 “partners” of that march. Also, this journalist first reported on the march leaders’ own close associations with Soros. Regarding Indivisible and the Women’s March, Politico reported: Indivisible is also embracing collaboration with other major   protest outlets. Leaders of the group were in communication with Women’s March organizers before their main event on Jan. 21, and that partnership will become official when the March unveils the third in its series of 10 direct actions that attendees have been asked to pursue in their communities. Another Indivisible leader mentioned in the Politico article is Jeremy Haile. Not reported by Politico is that is Haile served as federal advocacy counsel for the Sentencing Project.  The Sentencing Project is reportedly financed by Soros’s Open Society Foundations, which has also hosted the Project to promote its cause. Aaron Klein is Breitbart’s Jerusalem bureau chief and senior investigative reporter. He is a New York Times bestselling author and hosts the popular weekend talk radio program, “Aaron Klein Investigative Radio. ” Follow him on Twitter @AaronKleinShow. Follow him on Facebook.  ",0
11,"BBC Comedy Sketch ""Real Housewives of ISIS"" Causes Outrage",Chris Tomlinson,"The BBC produced spoof on the “Real Housewives” TV programmes, which has a comedic Islamic State twist, has been criticised by Leftists and Muslims who claim the sketch is offensive. [The BBC released the trailer earlier this week and were immediately slammed by those on the left and Muslims who thought that making fun of the brides of members of the terror group was out of the bounds of conventional humour. The sketch is part of a new programme called “Revolting” written by Jolyon Rubinstein and Heydon Prowse which, according to the BBC, is “satirising the state of the nation. ”  LOLOLOL pic. twitter.   —   Raheem Kassam (@RaheemKassam) January 4, 2017,  The BBC2 Facebook page was inundated with criticism. One user wrote, “I’m mortified that the BBC had produced such a programme. This is simply bad taste. The fact it is a comedy makes it even more worrying that humour should be associated with the actions of ISIS. Is this really what TV licenses are funding! ?” Others took a different point of view including a Muslim saying, “As a Muslim I find this HILARIOUS! Brilliant! The satire is on point highlighting the pathetic ideals of a pathetic group like ISIS. ” Not all Muslims agreed with the sentiment and users on Twitter expressed just as much outrage for the sketch. One man, a Bangladeshi, said “The BBC really made a satirical show called ‘The Real Housewives of ISIS’ while the real housewives of ISIS are being raped and abused daily. ”   The BBC really made a satirical show called ”The Real Housewives of ISIS” while the real housewives of ISIS are being raped and abused daily,  —   Meraj. (@UncleMeraj) January 4, 2017,  Another wrote, “‘Real Housewives of ISIS’ will make Hijabis feel more isolated n targeted by Islamophobes. Thanks @BBC for adding to the negative stereotype. ” ’Real Housewives of ISIS’ will make Hijabis feel more isolated n targeted by Islamophobes. Thanks @BBC for adding to the negative stereotype,  —   aѕн (@AshKaneSkittles) January 4, 2017,  Leftists also articulated how offended they were that the public broadcaster would dare create such a sketch mocking Islamic State. Some questioned whether the use of taxpayer money via the TV license fee should go toward the funding of the programme. As if people’s TV license in this country is going towards funding the production of a programme called ”the real housewives of ISIS”. Wow,  —   Cameron Edgar (@CammyyyEdgar) January 4, 2017,    The video itself has already been viewed millions of times on Facebook and other social media platforms.  The clip shows several women in hijabs talking to each other in a    house taking selfies and showing off their suicide belts to each other. One woman even mentions that she hadn’t come from Birmingham “to do this” as she scrubbed the floor of the home. Women joining Islamic State and travelling to Syria to become brides has become a real problem in European countries as the terror group promises young girls a more glamorous lifestyle. In 2014, eight schoolgirls from Bethnal Green travelled to Syria to become brides of Islamic State fighters, all of them under the age of 18.",0
12,Russian Researchers Discover Secret Nazi Military Base ‘Treasure Hunter’ in the Arctic [Photos],Amando Flavio,"The mystery surrounding The Third Reich and Nazi Germany is still a subject of debate between many observers. Some believe that Nazi Germany, under the control of Adolf Hitler, possessed supernatural powers, and largely employed pseudo-science during the 1933-1945 period. However, some also hold that the above belief is just a mere speculation without any proven fact. Over the years, researchers have searched extensively for answers to some of the more mysterious activities associated with Nazi Germany.
Nazi Germany invaded Russia (formerly the USSR) during the Second World War on June 22, 1941. At the time, the German army progressed deep into Russian territory, gaining ground close to the capital Moscow, before the Russians could counter-attack, eventually driving the Nazis back.
During the Nazi occupation in Russia, in 1942, the Nazis built a secret military base around the Arctic, code-named “Schatzgraber” or “Treasure Hunter,” which was reportedly very instrumental in the war against Russia. The base was primarily used as a tactical weather station for planning the strategic movements of Nazi troops, warships and submarines. The base also housed eminent Nazi scientists, whom conducted many experiments to help progress a German win of the war. It was widely speculated at the time that the Nazis used the base to contact aliens or extraterrestrial beings. The controversial Ahnenerbe was even linked to the base. The Ahnenerbe was an institute in Nazi Germany. Responsible for researching archaeological and cultural history of the Aryan race, it is rumored to have had heavy occult influences. Founded on July 1, 1935, by Heinrich Himmler, Herman Wirth and Richard Walther Darré, the Ahnenerbe later conducted experiments and launched expeditions in attempts to prove that mythological Nordic populations had once ruled the world.
However, the Nazis abandoned the base in 1944 – a time when the Russian army began its offensive, pushing the Germans out of the country. According to a war-time story, supplies had dwindled to dangerously low levels, and the Nazi officers stationed at the base outpost were forced to kill and eat polar bear, which ultimately, was infected with trichinosis. This caused those stationed at the base to fall severely ill and eventually they required rescue by a German U-boat. Despite Russian authors telling the story of “Treasure Hunter,” some observers consider it a myth, doubting its existence.
But Russian researchers have now announced that “Treasure Hunter” has been discovered, saying the base is on the island of Alexandra Land in the Arctic Circle, located 620 miles from the North Pole.
A senior researcher at the Russian Arctic National Park, Evgeny Ermolov said in a statement announcing the discovery : “Before it was only known from written sources, but now we also have real proof.”",1
13,US Officials See No Link Between Trump and Russia,Jason Ditz,"Clinton Campaign Demands FBI Affirm Trump's Russia Ties   
With the 2016 election campaign winding down, the Clinton campaign is ratcheting up demands for the FBI to publicly confirm the campaign’s allegations that Republican nominee Donald Trump is secretly in league with Russia. Sen. Harry Reid (D – NV) went so far as to claim the FBI has secret “explosive” evidence of coordination between the Trump campaign and the Russian government that it is withholding. 
FBI officials familiar with their investigations into the allegations, which the Clinton campaign started publicizing around the Democratic National Convention, say they’ve turned up nothing to connect Trump and Russia , leading FBI Director James Comey to decide against making any statements to that effect. 
The Clinton campaign has been making the allegations so long that they have taken to claiming “everyone knows” that they are true, and appears unsettled by the FBI’s refusal to sign off on the claims simply because they haven’t been able to find real evidence corroborating the story. 
The Trump campaign has repeatedly denied ties to Russia, but that didn’t stop Clinton from calling Trump a “puppet” of Russian President Vladimir Putin during the final presidential debate. The calls have grown since Friday’s FBI report to Congress about further Clinton emails being sought. 
With Clinton’s main campaign scandal growing in the waning weeks of the deal, some in her campaign have suggested that affirming Trump as secretly in league with the Russians would only be fair. Absent any evidence, however, it appears that won’t be happening.  ",1
14,"Re: Yes, There Are Paid Government Trolls On Social Media, Blogs, Forums And Websites",AnotherAnnie,"Yes, There Are Paid Government Trolls On Social Media, Blogs, Forums And Websites   February 26th, 2014 
Do you want solid proof that paid government shills are targeting websites, blogs, forums and social media accounts? For years, many have suspected that government trolls have been systematically causing havoc all over the Internet, but proving it has been difficult. But now thanks to documents leaked by Edward Snowden and revealed by Glenn Greenwald, we finally have hard evidence that western governments have been doing this. As you will see below, a UK intelligence outfit known as the Government Communications Headquarters, through a previously secret unit known as the Joint Threat Research Intelligence Group, has been systematically attempting “to control, infiltrate, manipulate, and warp online discourse”. This should be deeply disturbing to anyone that values free speech on the Internet. 
It isn’t just that the British government is trying to influence what people are thinking. The reality is that this is far bigger than a mere propaganda campaign. As Greenwald recently noted on his new website , the “integrity of the Internet itself” is at stake… 
By publishing these stories one by one, our NBC reporting highlighted some of the key, discrete revelations: the monitoring of YouTube and Blogger , the targeting of Anonymous with the very same DDoS attacks they accuse “hacktivists” of using, the use of “ honey traps ” (luring people into compromising situations using sex) and destructive viruses . But, here, I want to focus and elaborate on the overarching point revealed by all of these documents: namely, that these agencies are attempting to control, infiltrate, manipulate, and warp online discourse , and in doing so, are compromising the integrity of the internet itself. 
So what techniques are the British using to control and manipulate discourse on the Internet? According to Greenwald, the documents that Snowden has uncovered show that they are willing to sink to despicable lows in order to get the results that they desire… 
Among the core self-identified purposes of JTRIG are two tactics: (1) to inject all sorts of false material onto the internet in order to destroy the reputation of its targets; and (2) to use social sciences and other techniques to manipulate online discourse and activism to generate outcomes it considers desirable. To see how extremist these programs are, just consider the tactics they boast of using to achieve those ends: “ false flag operations ” (posting material to the internet and falsely attributing it to someone else), fake victim blog posts (pretending to be a victim of the individual whose reputation they want to destroy), and posting “ negative information ” on various forums. 
The following is a list of Internet infiltration techniques that were listed on one particular slide that Snowden leaked…
– Infiltration Operation 
– Sting Operation 
You can check out this slide for yourself right here . 
There is also evidence that the Canadian government has been involved in this sort of thing as well.   Natural News … 
You’ve probably run into them before — those seemingly random antagonizers who always end up diverting the conversation in an online chat room or article comment section away from the issue at hand, and towards a much different agenda. Hot-button issues like illegal immigration, the two-party political system, the “war on terror” and even alternative medicine are among the most common targets of such attackers, known as internet “trolls” or “shills,” who in many cases are nothing more than paid lackeys hired by the federal government and other international organizations to sway and ultimately control public opinion . 
Several years ago, Canada’s CTV News aired a short segment about how its own government had been exposed for hiring secret agents to monitor social media and track online conversations, as well as the activities of certain dissenting individuals. This report, which in obvious whitewashing language referred to such activities as the government simply “ weighing in and correcting ” allegedly false information posted online, basically admitted that the Canadian government had assumed the role of secret online police . 
You can see a video news report about this activity up in Canada right here . 
Are you disturbed yet? 
You should be. 
So what kind of people are the governments of the western world targeting online? 
Well, when it comes to the U.S. government, all you have to do is to look at their official documents to see who they consider the “problems” to be. For much more on this, please see my previous article entitled “ 72 Types Of Americans That Are Considered ‘Potential Terrorists’ In Official Government Documents “. 
Sadly, the reality of the matter is that the days of the free and open Internet are numbered. The governments of the world are increasing their control over the Internet with each passing day, and eventually a time will likely come when we will not be able to communicate openly like this any longer. 
Things have gotten so bad in the U.S. already that even Google is spooked … 
A recent court decision that endorsed a broad view of the Federal Communications Commission’s authority over the Internet has Google and other Web companies nervous. ,1
15,House Dem Aide: We Didn’t Even See Comey’s Letter Until Jason Chaffetz Tweeted It,Darrell Lucus,"House Dem Aide: We Didn’t Even See Comey’s Letter Until Jason Chaffetz Tweeted It By Darrell Lucus on October 30, 2016 Subscribe Jason Chaffetz on the stump in American Fork, Utah ( image courtesy Michael Jolley, available under a Creative Commons-BY license)
With apologies to Keith Olbermann, there is no doubt who the Worst Person in The World is this week–FBI Director James Comey. But according to a House Democratic aide, it looks like we also know who the second-worst person is as well. It turns out that when Comey sent his now-infamous letter announcing that the FBI was looking into emails that may be related to Hillary Clinton’s email server, the ranking Democrats on the relevant committees didn’t hear about it from Comey. They found out via a tweet from one of the Republican committee chairmen.
As we now know, Comey notified the Republican chairmen and Democratic ranking members of the House Intelligence, Judiciary, and Oversight committees that his agency was reviewing emails it had recently discovered in order to see if they contained classified information. Not long after this letter went out, Oversight Committee Chairman Jason Chaffetz set the political world ablaze with this tweet. FBI Dir just informed me, ""The FBI has learned of the existence of emails that appear to be pertinent to the investigation."" Case reopened
— Jason Chaffetz (@jasoninthehouse) October 28, 2016
Of course, we now know that this was not the case . Comey was actually saying that it was reviewing the emails in light of “an unrelated case”–which we now know to be Anthony Weiner’s sexting with a teenager. But apparently such little things as facts didn’t matter to Chaffetz. The Utah Republican had already vowed to initiate a raft of investigations if Hillary wins–at least two years’ worth, and possibly an entire term’s worth of them. Apparently Chaffetz thought the FBI was already doing his work for him–resulting in a tweet that briefly roiled the nation before cooler heads realized it was a dud.
